{
  "schemaVersion": "1.0.0",
  "season": "2025-26",
  "sourceSha256": "5565e64090b5d29f385f84587b3ef1f8c2511153b91f3e1b7369b1781cee86be",
  "transactions": [
    {
      "fantacalcioPlayerId": 572,
      "name": "Meret",
      "team": "Napoli",
      "role": "P",
      "mantraRole": "Por",
      "buyer": "Simo Q",
      "price": 45,
      "quotationInitial": 16,
      "quotationCurrent": 16,
      "quotationDelta": 0,
      "fvmPer1000": 95,
      "fvmTier": 1,
      "modelExpectedPrice": 45.5112,
      "modelResidual": -0.5112
    },
    {
      "fantacalcioPlayerId": 4312,
      "name": "Maignan",
      "team": "Milan",
      "role": "P",
      "mantraRole": "Por",
      "buyer": "Alessio",
      "price": 43,
      "quotationInitial": 16,
      "quotationCurrent": 16,
      "quotationDelta": 0,
      "fvmPer1000": 79,
      "fvmTier": 1,
      "modelExpectedPrice": 37.4395,
      "modelResidual": 5.5605
    },
    {
      "fantacalcioPlayerId": 5841,
      "name": "Svilar",
      "team": "Roma",
      "role": "P",
      "mantraRole": "Por",
      "buyer": "Andre",
      "price": 42,
      "quotationInitial": 15,
      "quotationCurrent": 16,
      "quotationDelta": 1,
      "fvmPer1000": 85,
      "fvmTier": 1,
      "modelExpectedPrice": 40.4664,
      "modelResidual": 1.5336
    },
    {
      "fantacalcioPlayerId": 4431,
      "name": "Carnesecchi",
      "team": "Atalanta",
      "role": "P",
      "mantraRole": "Por",
      "buyer": "IO",
      "price": 41,
      "quotationInitial": 14,
      "quotationCurrent": 14,
      "quotationDelta": 0,
      "fvmPer1000": 66,
      "fvmTier": 1,
      "modelExpectedPrice": 30.8812,
      "modelResidual": 10.1188
    },
    {
      "fantacalcioPlayerId": 5876,
      "name": "Di Gregorio",
      "team": "Juventus",
      "role": "P",
      "mantraRole": "Por",
      "buyer": "Cri",
      "price": 41,
      "quotationInitial": 16,
      "quotationCurrent": 17,
      "quotationDelta": 1,
      "fvmPer1000": 87,
      "fvmTier": 1,
      "modelExpectedPrice": 41.4753,
      "modelResidual": -0.4753
    },
    {
      "fantacalcioPlayerId": 2428,
      "name": "Sommer",
      "team": "Inter",
      "role": "P",
      "mantraRole": "Por",
      "buyer": "Carlo",
      "price": 41,
      "quotationInitial": 16,
      "quotationCurrent": 16,
      "quotationDelta": 0,
      "fvmPer1000": 86,
      "fvmTier": 1,
      "modelExpectedPrice": 40.9708,
      "modelResidual": 0.0292
    },
    {
      "fantacalcioPlayerId": 2521,
      "name": "De Gea",
      "team": "Fiorentina",
      "role": "P",
      "mantraRole": "Por",
      "buyer": "Marco",
      "price": 29,
      "quotationInitial": 14,
      "quotationCurrent": 14,
      "quotationDelta": 0,
      "fvmPer1000": 64,
      "fvmTier": 2,
      "modelExpectedPrice": 29.8722,
      "modelResidual": -0.8722
    },
    {
      "fantacalcioPlayerId": 2814,
      "name": "Provedel",
      "team": "Lazio",
      "role": "P",
      "mantraRole": "Por",
      "buyer": "IO",
      "price": 22,
      "quotationInitial": 12,
      "quotationCurrent": 12,
      "quotationDelta": 0,
      "fvmPer1000": 55,
      "fvmTier": 2,
      "modelExpectedPrice": 25.3318,
      "modelResidual": -3.3318
    },
    {
      "fantacalcioPlayerId": 133,
      "name": "Skorupski",
      "team": "Bologna",
      "role": "P",
      "mantraRole": "Por",
      "buyer": "Cri",
      "price": 20,
      "quotationInitial": 10,
      "quotationCurrent": 11,
      "quotationDelta": 1,
      "fvmPer1000": 50,
      "fvmTier": 2,
      "modelExpectedPrice": 22.8094,
      "modelResidual": -2.8094
    },
    {
      "fantacalcioPlayerId": 2170,
      "name": "Milinkovic-Savic V.",
      "team": "Napoli",
      "role": "P",
      "mantraRole": "Por",
      "buyer": "Simo Q",
      "price": 13,
      "quotationInitial": 4,
      "quotationCurrent": 4,
      "quotationDelta": 0,
      "fvmPer1000": 9,
      "fvmTier": 4,
      "modelExpectedPrice": 2.1256,
      "modelResidual": 10.8744
    },
    {
      "fantacalcioPlayerId": 6966,
      "name": "Butez",
      "team": "Como",
      "role": "P",
      "mantraRole": "Por",
      "buyer": "Nicola",
      "price": 10,
      "quotationInitial": 10,
      "quotationCurrent": 11,
      "quotationDelta": 1,
      "fvmPer1000": 34,
      "fvmTier": 2,
      "modelExpectedPrice": 14.7377,
      "modelResidual": -4.7377
    },
    {
      "fantacalcioPlayerId": 4360,
      "name": "Caprile",
      "team": "Cagliari",
      "role": "P",
      "mantraRole": "Por",
      "buyer": "Marco",
      "price": 6,
      "quotationInitial": 7,
      "quotationCurrent": 8,
      "quotationDelta": 1,
      "fvmPer1000": 19,
      "fvmTier": 3,
      "modelExpectedPrice": 7.1704,
      "modelResidual": -1.1704
    },
    {
      "fantacalcioPlayerId": 188,
      "name": "Leali",
      "team": "Genoa",
      "role": "P",
      "mantraRole": "Por",
      "buyer": "Andre",
      "price": 6,
      "quotationInitial": 8,
      "quotationCurrent": 9,
      "quotationDelta": 1,
      "fvmPer1000": 30,
      "fvmTier": 2,
      "modelExpectedPrice": 12.7197,
      "modelResidual": -6.7197
    },
    {
      "fantacalcioPlayerId": 6462,
      "name": "Okoye",
      "team": "Udinese",
      "role": "P",
      "mantraRole": "Por",
      "buyer": "Andre",
      "price": 6,
      "quotationInitial": 6,
      "quotationCurrent": 5,
      "quotationDelta": -1,
      "fvmPer1000": 15,
      "fvmTier": 3,
      "modelExpectedPrice": 5.1525,
      "modelResidual": 0.8475
    },
    {
      "fantacalcioPlayerId": 6641,
      "name": "Suzuki",
      "team": "Parma",
      "role": "P",
      "mantraRole": "Por",
      "buyer": "Nicola",
      "price": 6,
      "quotationInitial": 7,
      "quotationCurrent": 7,
      "quotationDelta": 0,
      "fvmPer1000": 14,
      "fvmTier": 3,
      "modelExpectedPrice": 4.648,
      "modelResidual": 1.352
    },
    {
      "fantacalcioPlayerId": 761,
      "name": "Audero",
      "team": "Cremonese",
      "role": "P",
      "mantraRole": "Por",
      "buyer": "Cri",
      "price": 5,
      "quotationInitial": 5,
      "quotationCurrent": 6,
      "quotationDelta": 1,
      "fvmPer1000": 13,
      "fvmTier": 3,
      "modelExpectedPrice": 4.1435,
      "modelResidual": 0.8565
    },
    {
      "fantacalcioPlayerId": 2134,
      "name": "Falcone",
      "team": "Lecce",
      "role": "P",
      "mantraRole": "Por",
      "buyer": "Carlo",
      "price": 2,
      "quotationInitial": 6,
      "quotationCurrent": 7,
      "quotationDelta": 1,
      "fvmPer1000": 18,
      "fvmTier": 3,
      "modelExpectedPrice": 6.6659,
      "modelResidual": -4.6659
    },
    {
      "fantacalcioPlayerId": 6184,
      "name": "Martinelli T.",
      "team": "Fiorentina",
      "role": "P",
      "mantraRole": "Por",
      "buyer": "Carlo",
      "price": 2,
      "quotationInitial": 1,
      "quotationCurrent": 1,
      "quotationDelta": 0,
      "fvmPer1000": 1,
      "fvmTier": 4,
      "modelExpectedPrice": 1,
      "modelResidual": 1
    },
    {
      "fantacalcioPlayerId": 4867,
      "name": "Turati",
      "team": "Sassuolo",
      "role": "P",
      "mantraRole": "Por",
      "buyer": "Nicola",
      "price": 2,
      "quotationInitial": 7,
      "quotationCurrent": 6,
      "quotationDelta": -1,
      "fvmPer1000": 7,
      "fvmTier": 4,
      "modelExpectedPrice": 1.1166,
      "modelResidual": 0.8834
    },
    {
      "fantacalcioPlayerId": 7179,
      "name": "Israel",
      "team": "Torino",
      "role": "P",
      "mantraRole": "Por",
      "buyer": "Simo Q",
      "price": 1,
      "quotationInitial": 9,
      "quotationCurrent": 8,
      "quotationDelta": -1,
      "fvmPer1000": 33,
      "fvmTier": 2,
      "modelExpectedPrice": 14.2332,
      "modelResidual": -13.2332
    },
    {
      "fantacalcioPlayerId": 6482,
      "name": "Mandas",
      "team": "Lazio",
      "role": "P",
      "mantraRole": "Por",
      "buyer": "Marco",
      "price": 1,
      "quotationInitial": 3,
      "quotationCurrent": 3,
      "quotationDelta": 0,
      "fvmPer1000": 3,
      "fvmTier": 4,
      "modelExpectedPrice": 1,
      "modelResidual": 0
    },
    {
      "fantacalcioPlayerId": 4236,
      "name": "Muric",
      "team": "Sassuolo",
      "role": "P",
      "mantraRole": "Por",
      "buyer": "Alessio",
      "price": 1,
      "quotationInitial": 3,
      "quotationCurrent": 3,
      "quotationDelta": 0,
      "fvmPer1000": 7,
      "fvmTier": 4,
      "modelExpectedPrice": 1.1166,
      "modelResidual": -0.1166
    },
    {
      "fantacalcioPlayerId": 6842,
      "name": "Sava",
      "team": "Udinese",
      "role": "P",
      "mantraRole": "Por",
      "buyer": "IO",
      "price": 1,
      "quotationInitial": 4,
      "quotationCurrent": 5,
      "quotationDelta": 1,
      "fvmPer1000": 11,
      "fvmTier": 3,
      "modelExpectedPrice": 3.1345,
      "modelResidual": -2.1345
    },
    {
      "fantacalcioPlayerId": 2815,
      "name": "Terracciano",
      "team": "Milan",
      "role": "P",
      "mantraRole": "Por",
      "buyer": "Alessio",
      "price": 1,
      "quotationInitial": 1,
      "quotationCurrent": 1,
      "quotationDelta": 0,
      "fvmPer1000": 1,
      "fvmTier": 4,
      "modelExpectedPrice": 1,
      "modelResidual": 0
    },
    {
      "fantacalcioPlayerId": 5513,
      "name": "Dumfries",
      "team": "Inter",
      "role": "D",
      "mantraRole": "E",
      "buyer": "Nicola",
      "price": 47,
      "quotationInitial": 20,
      "quotationCurrent": 21,
      "quotationDelta": 1,
      "fvmPer1000": 107,
      "fvmTier": 1,
      "modelExpectedPrice": 49.6827,
      "modelResidual": -2.6827
    },
    {
      "fantacalcioPlayerId": 254,
      "name": "Dimarco",
      "team": "Inter",
      "role": "D",
      "mantraRole": "E",
      "buyer": "Marco",
      "price": 40,
      "quotationInitial": 19,
      "quotationCurrent": 19,
      "quotationDelta": 0,
      "fvmPer1000": 94,